Category,Question,YAKE Keywords,Severity Score,Variations
Legal and Compliance,How does the company ensure compliance with these standards?,"standards, company, ensure, compliance|compliance aml kyc, aml kyc compliance, ensure compliance aml|compliance aml kyc, ensure compliance aml, compliance aml|compliance auditability standards, compliance auditability, auditability standards|compliance custody asset, custody asset security, ensure compliance custody|compliance custody key, ensure compliance custody, compliance custody|compliance cybersecurity standards, compliance cybersecurity, ensure compliance cybersecurity|project ensure compliance, compliance cybersecurity, ensure compliance cybersecurity|compliance financial standards, project ensure compliance, ensure compliance financial|project ensure compliance, compliance governance disclosures, ensure compliance governance|compliance governance strategic, project ensure compliance, ensure compliance governance|project ensure compliance, compliance governance voting, governance voting standards|compliance ip licensing, ip licensing standards, ensure compliance ip|infrastructure ecosystem standards, compliance infrastructure ecosystem, ecosystem standards|project ensure compliance, global risk standards, compliance jurisdictional global|project ensure compliance, regulatory compliance standards, compliance standards|project ensure compliance, compliance standards, legal compliance standards|compliance market conduct, project ensure compliance, ensure compliance market|compliance operational diligence, project ensure compliance, operational diligence standards|operational integrity standards, compliance operational integrity, project ensure compliance|compliance reputational strategic, reputational strategic standards, ensure compliance reputational|project ensure compliance, protocol risks standards, compliance smart contract|compliance technical standards, project ensure compliance, ensure compliance technical|compliance technical integrity, technical integrity standards, project ensure compliance|compliance tokenomics emissions, tokenomics emissions standards, ensure compliance tokenomics|compliance tokenomics financial, ensure compliance tokenomics, compliance tokenomics|compliance valuation verification, ensure compliance valuation, valuation verification standards",,[]
Legal and Compliance,"In which jurisdictions do you operate and how do you ensure compliance with local regulations (e.g. SEC, MiCA, FATF)?","compliance local regulations, local regulations sec, ensure compliance local|jurisdictions regulate project, compliance local laws, jurisdictions regulate",,[]
Legal and Compliance,Are you licensed as a VASP or MSB?,"licensed vasp msb, licensed vasp, vasp msb",,[]
Legal and Compliance,Describe your AML/CFT procedures. How do you verify user identities and monitor suspicious transactions?,"monitor suspicious transactions, identities monitor suspicious, user identities monitor|identities monitor transactions, aml kyc framework, kyc framework verify",,[]
Legal and Compliance,How do you comply with GDPR or CCPA for data collection/storage?,"comply gdpr ccpa, gdpr ccpa data, gdpr ccpa",,[]
Legal and Compliance,"Has your token been evaluated for classification as a security? If not ,why ?","evaluated classification security, token evaluated classification, classification security",,[]
Legal and Compliance,"How does the project handle tax reporting for users (e.g. capital gains, staking rewards)? Do you provide tools for tax tracking?","tools tax tracking, tax tracking, tax reporting users",,[]
Legal and Compliance,"If the project involves stablecoins, how are reserves managed? Are they audited for 1:1 backing?","stablecoins reserves managed, reserves managed audited, stablecoins reserves",,[]
Legal and Compliance,"What is your contingency plan if a major jurisdiction bans your token/NFT (e.g., China, India)?","jurisdiction bans token, major jurisdiction bans, bans token nft",,[]
Legal and Compliance,"How do you monitor and adapt to evolving regulations (e.g., EU’s DORA, US state-level crypto laws)?","evolving regulations, evolving regulations eu, adapt evolving regulations",,[]
Legal and Compliance,"Do you comply with data sovereignty laws (e.g., storing user data in specific regions)?","comply data sovereignty, data sovereignty laws, data sovereignty",,[]
Legal and Compliance,Are there mechanisms for employees/contractors to report compliance violations anonymously?,"compliance violations anonymously, contractors report compliance, violations anonymously",,[]
Legal and Compliance,"If a DeFi protocol, how do you address compliance with regulations like the EU’s Travel Rule?","regulations like eu, eu travel rule, defi protocol|evolving regulations, evolving regulations like, travel rule compliance",,[]
Technical,Why was this blockchain chosen? Is it a fork or new protocol?,"blockchain chosen fork, fork new protocol, blockchain chosen",,[]
Technical,Provide third-party audit reports for smart contracts. Were critical vulnerabilities addressed?,"contracts critical vulnerabilities, reports smart contracts, audit reports smart",,[]
Technical,How are protocol upgrades executed? Is there a timelock or multi-sig?,"protocol upgrades executed, upgrades executed timelock, protocol upgrades",,[]
Technical,"What is the TPS capacity, and how are fees managed during congestion?","tps capacity fees, tps capacity, fees managed congestion",,[]
Technical,What percentage of nodes/validators are controlled by the team or insiders?,"controlled team insiders, percentage nodes validators, validators controlled team",,[]
Technical,"Does the project rely on centralized APIs, oracles, or third-party services (e.g., AWS)?","centralized apis oracles, project rely centralized, rely centralized apis",,[]
Technical,"Is the blockchain’s cryptographic algorithm quantum-resistant (e.g., lattice-based)?","quantum resistant lattice, algorithm quantum resistant, quantum resistant",,[]
Technical,How are admin/private keys secured? Is there a dead man’s switch for emergency access?,"admin private keys, keys secured dead, private keys secured",,[]
Technical,How does the protocol mitigate front-running or sandwich attacks (MEV)?,"sandwich attacks mev, running sandwich attacks, sandwich attacks",,[]
Technical,"If bridging assets, how are bridge vulnerabilities managed (e.g., Wormhole exploit)?","assets bridge vulnerabilities, bridge vulnerabilities managed, bridging assets bridge",,[]
Technical,"If AI is part of the project, how are bias, data privacy, and code integrity ensured?","ai project bias, bias data privacy, project bias data",,[]
Technical,"If using ZK tech (e.g., zk-SNARKs), how are trusted setups managed?","zk snarks trusted, trusted setups, snarks trusted setups",,[]
Technical,How is the project’s website/app secured against DNS hijacking or phishing attacks?,"app secured dns, website app secured, dns hijacking phishing",,[]
Technical,"Can smart contracts be frozen? Who controls this function, and under what conditions?","smart contracts frozen, frozen controls function, contracts frozen controls",,[]
Technical,"Are liquidity pool tokens locked (e.g., via Unicrypt)? For how long?","pool tokens locked, liquidity pool tokens, tokens locked unicrypt|liquidity pool tokens, pool tokens burned, pool tokens",,[]
Financial,"Is the token supply fixed, inflationary, or deflationary? How is inflation managed?","supply fixed inflationary, deflationary inflation managed, inflation managed",,[]
Financial,How does the project generate revenue? What % of fees are burned/distributed?,"project generate revenue, generate revenue fees, revenue fees",,[]
Financial,How are project funds stored? Are multi-sig wallets used?,"project funds stored, sig wallets used, multi sig wallets",,[]
Financial,Are insider/advisor tokens subject to vesting? What triggers accelerated unlocks?,"insider advisor tokens, tokens subject vesting, vesting triggers accelerated",,[]
Financial,Is there a deflationary mechanism? How is burn transparency ensured?,"mechanism burn transparency, deflationary mechanism burn, burn transparency ensured",,[]
Financial,"How would the project manage a contentious fork (e.g., community splits)?","manage contentious fork, contentious fork community, contentious fork",,[]
Financial,"Are rewards for liquidity providers sustainable, or could they lead to hyperinflation?","liquidity providers sustainable, rewards liquidity providers, liquidity providers",,[]
Financial,What percentage of tokens are held by the top 10 wallets? Could they manipulate markets?,"percentage tokens held, wallets manipulate markets, percentage tokens",,[]
Financial,Do you use algorithmic market makers? Are there clauses to prevent wash trading?,"prevent wash trading, wash trading, algorithmic market makers",,[]
Financial,"If liquidity pools use stablecoins, how is depegging risk mitigated?","stablecoins depegging risk, pools use stablecoins, liquidity pools use",,[]
Financial,"How are airdrops structured to avoid regulatory scrutiny (e.g., unregistered securities)?","scrutiny unregistered securities, regulatory scrutiny unregistered, airdrops structured avoid",,[]
Financial,"Does token price directly fund operations, creating a death spiral if prices crash?","does token price, token price, token price directly",,[]
Financial,"If a PoS chain, what conditions trigger slashing, and how are validators insured?","slashing validators insured, slashing validators, pos chain conditions",,[]
Financial,"How do you prevent oracle failures (e.g., price feed exploits) from draining funds?","prevent oracle failures, exploits draining funds, oracle failures price",,[]
Financial,On which exchanges is the token listed? How deep is the liquidity?,"exchanges token listed, exchanges token, listed deep liquidity",,[]
Financial,How are funds secured with third-party custodians/exchanges?,"custodians exchanges, party custodians exchanges, funds secured",,[]
Financial,"Is liquidity locked in non-custodial contracts (e.g., Team Finance)? For how long?","liquidity locked, liquidity locked non, non custodial contracts",,[]
Financial,Do liquidity pools use multiple stablecoins to mitigate single-stablecoin depegs?,"single stablecoin depegs, stablecoin depegs, stablecoins mitigate single",,[]
Financial,"How are third-party custodians (e.g., Fireblocks, Copper) audited for security?","copper audited security, audited security, fireblocks copper audited",,[]
Reputational and Strategic,"Can governments or third parties censor transactions (e.g., Tornado Cash)?","parties censor transactions, censor transactions, censor transactions tornado",,[]
Reputational and Strategic,"How do you onboard non-crypto-native users (e.g., fiat ramps, UX simplicity)?","onboard non crypto, crypto native users, native users fiat",,[]
Reputational and Strategic,"For gaming/NFT projects, are there limits on spending or playtime to prevent addiction?","playtime prevent addiction, limits spending playtime, spending playtime prevent",,[]
Auditability,"Can you share real-time metrics (e.g., active users, transaction volume, retention rates)?","metrics active users, real time metrics, share real time",,[]
Auditability,Are GitHub repositories public? How frequently are commits/updates made?,"github repositories public, repositories public frequently, github repositories",,[]
Auditability,"Does the whitepaper omit technical/economic details, or make unrealistic assumptions?","whitepaper omit technical, does whitepaper omit, whitepaper omit",,[]
Auditability,"How often are whitepapers, FAQs, and GitHub docs updated?","whitepapers faqs github, github docs updated, faqs github docs",,[]
Auditability,"Can you share testnet participation metrics (e.g., validators, transaction volume)?","testnet participation metrics, share testnet participation, testnet participation",,[]
Auditability,"Have independent researchers (e.g., universities) peer-reviewed your protocol?","peer reviewed protocol, independent researchers, independent researchers universities",,[]
Legal and Compliance,"How is your token/NFT classified (utility, security, payment, etc.)? What legal analysis supports this classification?","token nft classified, token nft, nft classified utility",,[]
Legal and Compliance,"If deemed a security, how do you comply with registration, disclosure, or exemption requirements (e.g., Reg D, SAFT)?","security comply registration, comply registration disclosure, security comply",,[]
Technical,Which third-party firms audited your code? Are audits public? How are vulnerabilities patched post-deployment?,"code audits public, firms audited code, audited code audits",,[]
Technical,"Is the project sufficiently decentralized to mitigate regulatory risks (e.g., avoiding 'common enterprise' claims)?","decentralized mitigate regulatory, project sufficiently decentralized, mitigate regulatory risks",,[]
Technical,How do you ensure compliance when interacting with other blockchains or bridges?,"compliance interacting blockchains, ensure compliance interacting, interacting blockchains bridges",,[]
Legal and Compliance,"How do you assist users with tax reporting (e.g., issuing 1099s)? What is the token's tax treatment in key jurisdictions?","1099s token tax, token tax treatment, issuing 1099s token",,[]
Reputational and Strategic,"How do you ensure marketing claims (ROI, partnerships) are substantiated? Do you prohibit influencers from making unverified statements?","ensure marketing claims, marketing claims roi, marketing claims",,[]
Reputational and Strategic,"Have you faced regulatory inquiries, hacks, or fraud? How were they resolved?","regulatory inquiries hacks, faced regulatory inquiries, inquiries hacks fraud",,[]
Financial,"If offering staking/yield, how do you ensure it isn't classified as a security (e.g., Howey Test analysis)?","staking yield ensure, offering staking yield, staking yield",,[]
Cybersecurity,How do you educate users to avoid phishing? Do you monitor for counterfeit sites/social media?,"avoid phishing monitor, users avoid phishing, avoid phishing",,[]
Legal and Compliance,"How do you restrict access in jurisdictions where your project is prohibited (e.g., Iran, North Korea)?","restrict access jurisdictions, jurisdictions project prohibited, restrict access",,[]
Legal and Compliance,"Do you hold licenses for regulated activities (e.g., VASP, MTF) in jurisdictions where you operate?","licenses regulated activities, hold licenses regulated, licenses regulated",,[]
Legal and Compliance,"How do you handle VAT, GST, or other taxes for users in jurisdictions with crypto tax regimes?","jurisdictions crypto tax, crypto tax regimes, crypto tax",,[]
Technical,"Who controls admin keys or backdoors? How are they secured (e.g., multi-sig, time locks)?","admin keys backdoors, keys backdoors secured, backdoors secured",,[]
Technical,"Can transactions be halted? Under what circumstances, and who authorizes this?","transactions halted circumstances, transactions halted, halted circumstances authorizes",,[]
Legal and Compliance,How will you adapt to upcoming regulations like the EU's MiCA or the U.S. Executive Order on crypto?,"executive order crypto, adapt upcoming regulations, upcoming regulations",,[]
Legal and Compliance,What if a major jurisdiction bans your project? How would you pivot or wind down?,"jurisdiction bans project, major jurisdiction bans, jurisdiction bans",,[]
Cybersecurity,"Do core team members use hardware wallets, multi-factor authentication, or undergo phishing training?","undergo phishing training, phishing training, authentication undergo phishing",,[]
Cybersecurity,"Does your blockchain/protocol have quantum-resistant cryptography (e.g., lattice-based algorithms)?","quantum resistant cryptography, protocol quantum resistant, quantum resistant",,[]
Cybersecurity,"What contingency plans exist if quantum computing breaks existing encryption standards (e.g., ECDSA)?","existing encryption standards, encryption standards ecdsa, encryption standards",,[]
Reputational and Strategic,"If PoW-based, do you purchase carbon offsets or use renewable energy? Are claims verified by third parties?","renewable energy claims, purchase carbon offsets, energy claims verified",,[]
Reputational and Strategic,"How do you align with ESG (Environmental, Social, Governance) frameworks for institutional investors?","frameworks institutional investors, institutional investors, frameworks institutional",,[]
Cybersecurity,How does your protocol mitigate miner extractable value (MEV) or bot front-running in DeFi transactions?,"protocol mitigate miner, mitigate miner extractable, defi transactions",,[]
Financial,"How are algorithmic stablecoins stress-tested against hyperinflation or 'death spirals' (e.g., TerraUSD collapse)?","algorithmic stablecoins stress, stablecoins stress tested, stablecoins stress",,[]
Financial,"Are there circuit breakers or stabilization mechanisms (e.g., arbitrage incentives) to maintain the peg?","incentives maintain peg, maintain peg, arbitrage incentives maintain",,[]
Technical,How many independent oracles feed data to your protocol? What happens if a majority are compromised?,"independent oracles feed, independent oracles, protocol happens majority",,[]
Technical,"Are oracle data sources decentralized (e.g., Chainlink) or centralized (e.g., Binance API)?","data sources decentralized, oracle data sources, sources decentralized",,[]
Legal and Compliance,"Which jurisdiction's courts govern disputes (e.g., Switzerland, Singapore)? Are binding arbitration clauses included?","singapore binding arbitration, binding arbitration clauses, courts govern disputes",,[]
Legal and Compliance,How do you ensure compliance with labor laws for remote team members or contractors across jurisdictions?,"compliance labor laws, labor laws remote, ensure compliance labor",,[]
Legal and Compliance,"Do marketing materials comply with jurisdiction-specific ad laws (e.g., UK's CAP Code, FTC guidelines)?","marketing materials comply, ad laws uk, specific ad laws",,[]
Auditability,"If custodial, do you publish Proof-of-Reserves audits? How frequently, and by whom?","reserves audits frequently, proof reserves audits, reserves audits",,[]
Auditability,"Are user funds co-mingled, or held in segregated accounts?","user funds mingled, segregated accounts, funds mingled",,[]
Technical,"How do you ensure compliance and security when operating on Layer 2s or sidechains (e.g., Polygon, Arbitrum)?","layer 2s sidechains, ensure compliance security, sidechains polygon arbitrum",,[]
Technical,Are bridges between Layer 1 and Layer 2 audited for centralization risks?,"layer audited centralization, audited centralization risks, audited centralization",,[]
Reputational and Strategic,"What is your protocol for public communication during crises (e.g., hacks, regulatory crackdowns)?","public communication crises, communication crises hacks, communication crises",,[]
Technical,"If using ZK-proofs (e.g., zkRollups), how do you balance privacy with regulators' demands for auditability?","zkrollups balance privacy, regulators demands auditability, using zk proofs",,[]
Technical,Is any code forked from other projects? How are licensing/attribution requirements met?,"forked projects licensing, code forked projects, projects licensing attribution",,[]
Legal and Compliance,"In which jurisdictions do you operate, and under which regulatory bodies are you registered?","regulatory bodies registered, jurisdictions operate regulatory, operate regulatory bodies",,[]
Legal and Compliance,"Have you obtained legal opinions confirming your project does not violate securities laws (e.g., Howey Test analysis)?","does violate securities, violate securities, violate securities laws",,[]
Legal and Compliance,"Are you integrated with blockchain analytics tools (e.g., Chainalysis)?","blockchain analytics tools, integrated blockchain analytics, analytics tools chainalysis",,"['Are blockchain analytics tools (e.g., Chainalysis, Elliptic) integrated to detect illicit or high-risk transactions in real time?']"
Legal and Compliance,"How do you ensure tax reporting (e.g., FATCA, IRS Form 1099)?","reporting fatca irs, ensure tax reporting, tax reporting fatca",,[]
Legal and Compliance,"How do you block users from OFAC-sanctioned countries (e.g., Iran, North Korea)?","ofac sanctioned countries, block users ofac, block users",,[]
Legal and Compliance,"Are decentralized features (e.g., DEX swaps) geofenced? If so, how?","swaps geofenced, decentralized features dex, dex swaps geofenced",,[]
Legal and Compliance,Do non-resident users trigger FBAR or CRS reporting obligations?,"fbar crs reporting, users trigger fbar, crs reporting obligations",,[]
Technical,Have smart contracts undergone third-party audits? Provide reports.,"audits provide, party audits provide, audits provide reports",,[]
Technical,Is there a kill switch or upgrade mechanism for exploits?,"upgrade mechanism exploits, kill switch upgrade, mechanism exploits",,[]
Technical,"Do you have insurance coverage for digital assets (e.g., custodial breaches)?","insurance coverage digital, coverage digital assets, digital assets custodial",,[]
Technical,"If using oracles (e.g., Chainlink), how is data integrity ensured?","chainlink data integrity, data integrity ensured, data integrity",,[]
Technical,"Does the project depend on centralized APIs (e.g., AWS) that could disrupt service?","centralized apis aws, centralized apis, depend centralized apis",,[]
Technical,Is the team's wallet activity auditable on-chain?,"wallet activity auditable, activity auditable chain, team wallet activity",,[]
Auditability,Is the whitepaper/technical documentation audited for accuracy?,"documentation audited accuracy, technical documentation audited, documentation audited",,[]
Auditability,"Are promotional claims (e.g., ROI, partnerships) substantiated?","promotional claims roi, promotional claims, claims roi partnerships",,[]
Auditability,Do influencers disclose paid promotions per regulations?,"paid promotions regulations, disclose paid promotions, influencers disclose paid",,[]
Auditability,"Are reported metrics (user counts, TVL) independently verifiable?","tvl independently verifiable, reported metrics user, metrics user counts",,[]
Auditability,How is 'wash trading' prevented in NFT marketplaces?,"wash trading prevented, wash trading, prevented nft marketplaces",,[]
Legal and Compliance,Are staking/yield mechanisms compliant with interest-bearing regulations?,"staking yield mechanisms, staking yield, yield mechanisms compliant",,[]
Legal and Compliance,How are rewards taxed for users?,"rewards taxed users, rewards taxed, taxed users",,[]
Reputational and Strategic,"What percentage of energy sources are renewable? Are there carbon offset initiatives, and how are they audited?","renewable carbon offset, sources renewable carbon, energy sources renewable",,[]
Reputational and Strategic,How does the project address e-waste from mining hardware or node infrastructure?,"waste mining, waste mining hardware, address waste mining",,[]
Reputational and Strategic,"Are there commitments to transition to greener technologies (e.g., Ethereum's shift to PoS)? Include timelines and accountability measures.","transition greener technologies, greener technologies ethereum, greener technologies",,[]
Reputational and Strategic,"How does the project's roadmap align with global climate goals (e.g., Paris Agreement)?","climate goals paris, global climate goals, climate goals",,[]
Reputational and Strategic,"Beyond e-waste, how are raw materials (e.g., semiconductors, rare earth metals) sourced for mining/node hardware? Are supply chains audited for conflict minerals or unethical mining practices?","metals sourced mining, earth metals sourced, metals sourced",,[]
Reputational and Strategic,Does the project account for water consumption and land-use impacts of data centers or mining farms?,"water consumption land, impacts data centers, project account water",,[]
Reputational and Strategic,"If the project relies on layer-2 solutions or cross-chain interoperability, what is the environmental footprint of the underlying blockchain (e.g., Bitcoin/Ethereum)?","interoperability environmental footprint, chain interoperability environmental, environmental footprint underlying",,[]
Reputational and Strategic,"Are decentralized storage solutions (e.g., IPFS, Filecoin) used for NFTs energy-efficient?","decentralized storage solutions, nfts energy efficient, decentralized storage",,[]
Reputational and Strategic,How does the project ensure accessibility for unbanked/underbanked populations? Does it risk exacerbating financial exclusion?,"ensure accessibility unbanked, accessibility unbanked underbanked, accessibility unbanked",,[]
Reputational and Strategic,"What safeguards exist to protect users from volatility, fraud, or scams (e.g., rug pulls)?","protect users volatility, protect users, safeguards exist",,[]
Reputational and Strategic,"Describe the diversity (gender, ethnicity, geography) of the core team and advisory boards.","diversity gender, diversity gender ethnicity, team advisory boards",,[]
Reputational and Strategic,How are marginalized or disproportionately affected communities engaged in decision-making?,"communities engaged decision, marginalized disproportionately affected, disproportionately affected communities",,[]
Reputational and Strategic,"Does the project audit hardware/mining partners for conflict minerals (e.g., cobalt, tantalum)?","partners conflict minerals, conflict minerals cobalt, does project audit",,[]
Reputational and Strategic,Are there measures to prevent exploitative labor practices in mining or development?,"prevent exploitative labor, exploitative labor practices, labor practices mining",,[]
