question,category,severity,data_accessibility,category_risk,strategic_impact,risk_score,error,raw_output
Have financial and technical audits been conducted by reputable third parties?,Auditability,8.0,9.0,7.0,6.0,4.64,,
Are audit results publicly disclosed and updated regularly?,Auditability,2.0,1.0,3.0,2.0,1.79,,
"Is ownership of code, IP, and token distribution clearly verifiable and traceable?",Auditability,2.0,1.0,3.0,4.0,2.5,,
"What audit firms have been engaged, and what were their findings?",Auditability,2.0,1.0,3.0,4.0,2.5,,
Is there a historical record of audits over multiple versions/releases?,Auditability,2.0,1.0,3.0,4.0,2.5,,
Is IP ownership centralized or distributed among DAO or contributors?,Auditability,3.0,2.0,1.0,4.0,2.21,,
"Who is responsible for securing private keys, and what is their background and experience?",Cybersecurity,4.0,3.0,5.0,2.0,2.5,,
"Are private keys secured using HSMs, MPC, or air-gapped cold storage?",Cybersecurity,8.0,9.0,7.0,6.0,4.64,,
"Has the custodian provided a Type II SOC report on controls, and are exceptions disclosed?",Cybersecurity,3.0,2.0,4.0,1.0,1.79,,
"What is the process for private key access, and does it require dual control or multi-factor authentication?",Cybersecurity,6.0,4.0,5.0,3.0,3.29,,
Does the custodian support proof-of-existence or auditability for wallets on demand?,Cybersecurity,6.0,4.0,5.0,3.0,3.29,,
"For self-custody: are internal policies and segregated infrastructure in place, and are controls independently verified?",Cybersecurity,6.0,5.0,7.0,4.0,3.93,,
"Does the protocol utilize proxy patterns, and are upgrade mechanisms secured and transparent?",Technical,6.0,5.0,4.0,3.0,2.93,,
Have there been flash loan or oracle exploits on this protocol or similar ones in the ecosystem?,Technical,7.0,5.0,6.0,4.0,4.0,,
Are contracts covered by formal verification or continuous security fuzzing?,Technical,8.0,7.0,9.0,6.0,5.36,,
"Are on-chain AML analytics tools (e.g., TRM Labs, Chainalysis) used for monitoring wallet behavior?",Legal and Compliance,6.0,8.0,5.0,7.0,4.14,,
Is there a process to screen for sanctioned wallets or high-risk counterparties?,Legal and Compliance,8.0,6.0,7.0,5.0,4.71,,
"Does the platform support privacy-preserving KYC (e.g., zero-knowledge proofs)?",Legal and Compliance,3.0,2.0,1.0,4.0,2.21,,
Are AML/KYC policies aligned with FATF Travel Rule requirements?,Legal and Compliance,3.0,2.0,1.0,4.0,2.21,,
How often is staff trained on evolving AML compliance risks?,Legal and Compliance,7.0,8.0,6.0,9.0,5.36,,
Are assets priced using time-weighted average from multiple exchanges?,Financial,4.0,3.0,2.0,1.0,1.5,,
"How are illiquid assets valued, and who signs off on methodology?",Financial,6.0,4.0,5.0,3.0,3.29,,
Are wallet addresses independently verified by fund administrators?,Financial,3.0,2.0,1.0,4.0,2.21,,
"How frequently is the fund’s NAV calculated, and are there deviation logs for exceptions?",Financial,2.0,1.0,3.0,1.0,1.43,,
Is there a roadmap for future compliance in new jurisdictions?,Legal and Compliance,7.0,5.0,6.0,8.0,5.43,,
Have the terms of use or whitepaper been legally vetted for investor disclosures?,Legal and Compliance,4.0,2.0,3.0,1.0,1.86,,
Is there a clear distinction between utility and investment functions of the token?,Legal and Compliance,3.0,2.0,4.0,1.0,1.79,,
Has the project implemented data privacy policies in line with GDPR or other laws?,Legal and Compliance,3.0,2.0,1.0,4.0,2.21,,
What is the incident response time target for security breaches?,Cybersecurity,7.0,4.0,6.0,8.0,5.57,,
Are there anomaly detection systems in place for network activity?,Cybersecurity,4.0,3.0,2.0,1.0,1.5,,
Has the protocol been subjected to red teaming or adversarial testing?,Cybersecurity,7.0,6.0,8.0,5.0,4.64,,
What role do validators or miners play in protocol-level security checks?,Cybersecurity,2.0,1.0,3.0,4.0,2.5,,
"Who is the digital asset custodian, and is it a third party or self-custody setup?",Cybersecurity,2.0,1.0,3.0,4.0,2.5,,
"How are private keys stored—air-gapped, HSM, or MPC-based infrastructure?",Cybersecurity,8.0,6.0,9.0,7.0,5.86,,
Does the custodian offer verifiable proof-of-reserves?,Cybersecurity,7.0,5.0,8.0,9.0,6.21,,
"In cases of self-custody, what controls ensure exclusive access to private keys?",Cybersecurity,3.0,2.0,1.0,4.0,2.21,,
Are wallet addresses segregated and attributable per investor?,Cybersecurity,4.0,2.0,3.0,1.0,1.86,,
"Is the project aligned with MiCA, FATF, and national frameworks (e.g., SEC, CFTC, MAS)?",Legal and Compliance,8.0,9.0,6.0,5.0,4.07,,
Are Travel Rule compliance mechanisms in place for transfers above set thresholds?,Legal and Compliance,5.0,8.0,6.0,4.0,3.0,,
"What sandbox programs (e.g., HKMA, EU DLT Pilot Regime) has the project participated in?",Legal and Compliance,2.0,1.0,3.0,4.0,2.5,,
How does the entity classify tokens under securities law across jurisdictions?,Legal and Compliance,4.0,2.0,3.0,5.0,3.29,,
Has the issuer published mandatory whitepapers as per MiCA or local equivalents?,Legal and Compliance,4.0,2.0,3.0,1.0,1.86,,
"Are the founders and executives publicly identifiable, and do they have any history of controversies or regulatory violations?",Reputational and Strategic,3.0,2.0,4.0,1.0,1.79,,
"Is there a succession plan for key individuals, and how does the project mitigate key-person risk?",Reputational and Strategic,2.0,1.0,3.0,4.0,2.5,,
"Have there been any significant changes in the leadership team recently, and how were these communicated to stakeholders?",Reputational and Strategic,2.0,1.0,3.0,4.0,2.5,,
"How is the entity structured legally (e.g., foundation, corporation, DAO), and is this structure transparent and adequately documented?",Reputational and Strategic,5.0,3.0,4.0,2.0,2.57,,
"Are there any outstanding legal disputes, regulatory investigations, or credible allegations against the team or the entity?",Reputational and Strategic,7.0,9.0,5.0,6.0,3.93,,
How does the project handle accountability and public communication if a senior member is implicated in misconduct?,Reputational and Strategic,4.0,2.0,3.0,5.0,3.29,,
"Is there a publicly available ESG report or sustainability roadmap, and what metrics are used to track performance?",Reputational and Strategic,2.0,1.0,3.0,4.0,2.5,,
"How does the consensus mechanism (e.g., Proof-of-Work, Proof-of-Stake) impact the project's overall environmental footprint?",Reputational and Strategic,6.0,8.0,5.0,4.0,3.07,,
"What community or social initiatives does the project support or participate in, and how are they funded?",Reputational and Strategic,3.0,2.0,1.0,4.0,2.21,,
"Have any known ESG concerns been identified, and how is the team working to address or mitigate them?",Reputational and Strategic,6.0,4.0,5.0,7.0,4.71,,
Does the project have policies ensuring fair labour practices and diversity among its team and validators/miners (if applicable)?,Reputational and Strategic,4.0,1.0,3.0,5.0,3.43,,
Are there governance mechanisms to allow stakeholder input into environmental or social impact decisions?,Reputational and Strategic,2.0,3.0,1.0,4.0,1.79,,
How does the project integrate ESG considerations into its long-term strategic planning and reporting?,Reputational and Strategic,3.0,2.0,1.0,4.0,2.21,,
Has the token or digital asset been evaluated under the Howey Test (or comparable local standard) to determine if it is a security?,Legal and Compliance,7.0,9.0,6.0,5.0,3.79,,
Are there legal opinions or memoranda publicly available that clarify the asset's classification under securities laws?,Legal and Compliance,6.0,7.0,8.0,5.0,4.21,,
Has the project conducted any token sales or offerings that could be subject to retrospective regulatory scrutiny?,Legal and Compliance,7.0,6.0,5.0,4.0,3.64,,
"Does the project comply with disclosures, filings, or registrations required in any jurisdictions where it operates?",Legal and Compliance,3.0,2.0,4.0,1.0,1.79,,
"If the token is used for fundraising, were proper exemptions (Reg D, Reg S, etc.) or equivalent utilized, and is ongoing compliance maintained?",Legal and Compliance,5.0,2.0,4.0,3.0,3.07,,
"Which jurisdictions currently restrict or forbid the trading of this token, and how does the project handle users from those regions?",Legal and Compliance,7.0,5.0,6.0,8.0,5.43,,
"Are there or have there been any class-action lawsuits, SEC investigations, or regulatory enforcement actions involving the token?",Legal and Compliance,7.0,5.0,6.0,8.0,5.43,,
How does the project anticipate and adapt to evolving securities laws across different countries?,Legal and Compliance,6.0,4.0,5.0,7.0,4.71,,
"Which specific AML/KYC frameworks does the project adhere to, and are they aligned with FATF recommendations or local regulations?",Legal and Compliance,8.0,9.0,7.0,5.0,4.29,,
"Does the project have dedicated compliance officers, and are they experienced in digital asset regulations?",Legal and Compliance,8.0,6.0,5.0,4.0,3.93,,
How does the project ensure ongoing compliance with sanctions regimes or restricted jurisdictions?,Legal and Compliance,6.0,4.0,5.0,3.0,3.29,,
Are there defined processes for suspicious activity reporting and transaction monitoring on-chain?,Legal and Compliance,7.0,8.0,9.0,6.0,4.93,,
How does the project manage data protection obligations such as GDPR or other privacy laws?,Legal and Compliance,4.0,3.0,2.0,1.0,1.5,,
"If the platform provides exchange or custodial services, is it registered or licensed with relevant financial authorities?",Legal and Compliance,8.0,6.0,7.0,9.0,6.14,,
"Does the project have a formal code of conduct or compliance handbook, and are staff regularly trained on it?",Legal and Compliance,6.0,4.0,5.0,3.0,3.29,,
How do governance token holders or the foundation (if applicable) handle compliance oversight?,Legal and Compliance,7.0,5.0,8.0,6.0,5.14,,
"Has the project historically been connected to any money laundering, terrorist financing, or hacking incidents?",Legal and Compliance,6.0,3.0,5.0,4.0,3.79,,
What thresholds or alerts trigger enhanced due diligence for large or suspicious transactions?,Legal and Compliance,8.0,6.0,9.0,7.0,5.86,,
How does the project mitigate the risk of privacy-enhancing features (like mixers or tumblers) being used maliciously?,Legal and Compliance,4.0,3.0,2.0,5.0,2.93,,
"Are addresses or entities identified on sanctions lists (e.g., OFAC, EU sanctions) proactively blocked or flagged?",Legal and Compliance,6.0,4.0,5.0,3.0,3.29,,
Does the project collaborate with law enforcement agencies or industry consortia to share threat intelligence?,Legal and Compliance,2.0,1.0,3.0,4.0,2.5,,
Are there protocols to freeze assets or halt transactions in the event of a security breach or regulatory directive?,Legal and Compliance,8.0,5.0,7.0,9.0,6.29,,
What measures are in place to address potential black market or dark web usage of the token or platform?,Legal and Compliance,7.0,6.0,8.0,5.0,4.64,,
"Is there a clear framework for cybersecurity governance, and who is accountable at an executive level?",Cybersecurity,7.0,5.0,6.0,8.0,5.43,,
"Does the project conduct periodic penetration tests or red-team exercises, and are results used to improve security posture?",Cybersecurity,8.0,6.0,7.0,9.0,6.14,,
Which hardware security modules (HSMs) or other secure key management systems are used for private key custody?,Cybersecurity,2.0,3.0,1.0,4.0,1.79,,
"Are bug bounty programs in place to incentivize ethical hacking, and how does the team respond to reported vulnerabilities?",Cybersecurity,4.0,5.0,3.0,2.0,1.79,,
"What is the process for managing zero-day exploits or critical vulnerabilities (e.g. crisis response teams, hotfix protocols)?",Cybersecurity,8.0,6.0,9.0,7.0,5.86,,
"Is multi-factor authentication (MFA) mandatory for all administrators, developers, and high-privilege accounts?",Cybersecurity,8.0,6.0,7.0,9.0,6.14,,
"How is physical security addressed in data centres, hardware wallets, or any colocation facilities?",Cybersecurity,6.0,5.0,7.0,4.0,3.93,,
"Does the project follow any well-known security frameworks (ISO 27001, NIST Cybersecurity Framework, etc.) for best practices?",Cybersecurity,7.0,8.0,5.0,9.0,5.14,,
"Which audit firms or reputable third-party organizations have been engaged, and what was the scope of each audit?",Auditability,2.0,1.0,3.0,1.0,1.43,,
Does the project publicly share cryptographic proof of reserves or on-chain attestations for asset ownership?,Auditability,8.0,6.0,5.0,9.0,5.71,,
"How are compliance audits (like SOC 1/2 or ISAE 3402) handled, and are their results disclosed to stakeholders?",Auditability,6.0,5.0,7.0,4.0,3.93,,
Are transaction histories and logs easily accessible and verifiable on-chain for transparency?,Auditability,2.0,8.0,4.0,6.0,2.43,,
"Are token holders or governing bodies empowered to request or approve special audits (e.g., for treasury activities)?",Auditability,4.0,3.0,5.0,2.0,2.5,,
"In cases of asset tokenization, how does the project legally ensure that on-chain ownership matches real-world rights?",Auditability,5.0,3.0,4.0,2.0,2.57,,
"How frequently is environmental, social and governance (esg) evaluated or updated, and by whom?",Auditability,3.0,2.0,1.0,4.0,2.21,,
What are the biggest risks currently facing the project's strategic partnerships practices?,Cybersecurity,7.0,5.0,6.0,8.0,5.43,,
How does the project benchmark its media and community perception performance against industry standards?,Legal and Compliance,2.5,4.8,3.1,1.9,1.37,,
"Is there independent oversight or review over the network design process? If so, by which entities?",Legal and Compliance,6.0,5.0,4.0,3.0,2.93,,
What tools or frameworks does the team use to manage smart contract risk effectively?,Legal and Compliance,8.0,9.0,6.0,7.0,4.79,,
Have there been any reported issues or audits related to upgrades and maintenance in the past 12 months?,Auditability,2.0,1.0,1.0,3.0,1.71,,
How does the team prioritize improvements and risk mitigation for protocol scalability?,Auditability,4.0,3.0,5.0,2.0,2.5,,
"How frequently is treasury management evaluated or updated, and by whom?",Cybersecurity,2.0,1.0,3.0,4.0,2.5,,
"How frequently is disaster recovery evaluated or updated, and by whom?",Cybersecurity,3.0,2.0,4.0,1.0,1.79,,
"How frequently is strategic partnerships evaluated or updated, and by whom?",Reputational and Strategic,2.0,1.0,3.0,4.0,2.5,,
"How frequently is media and community perception evaluated or updated, and by whom?",Reputational and Strategic,2.0,1.0,3.0,4.0,2.5,,
"How frequently is threat intelligence evaluated or updated, and by whom?",Cybersecurity,3.0,2.0,1.0,4.0,2.21,,
"How frequently is securities analysis evaluated or updated, and by whom?",Legal and Compliance,6.0,8.0,5.0,4.0,3.07,,
What are the biggest risks currently facing the project's licensing and jurisdiction practices?,Legal and Compliance,7.0,5.0,9.0,8.0,6.07,,
"How frequently is licensing and jurisdiction evaluated or updated, and by whom?",Legal and Compliance,7.0,5.0,8.0,9.0,6.21,,
"How frequently is proof-of-reserves evaluated or updated, and by whom?",Auditability,2.5,1.0,4.0,3.0,2.5,,
What are the biggest risks currently facing the project's on-chain traceability practices?,Auditability,7.0,5.0,8.0,6.0,5.14,,
"How frequently is regulatory reporting evaluated or updated, and by whom?",Legal and Compliance,7.0,8.0,6.0,5.0,3.93,,
How does the project benchmark its governance and operational security performance against industry standards?,Cybersecurity,7.0,8.0,6.0,9.0,5.36,,
"How frequently is on-chain traceability evaluated or updated, and by whom?",Auditability,2.0,1.0,3.0,4.0,2.5,,
What are the biggest risks currently facing the project's governance and operational security practices?,Cybersecurity,60.0,40.0,20.0,80.0,44.29,,
