Category,Question,YAKE Keywords,Severity Score,Variations
Legal and Compliance,In which jurisdictions is the digital asset/cryptocurrency operating?,"asset, cryptocurrency, operating, jurisdictions, digital",,[]
Legal and Compliance,What are the applicable laws and regulations in those jurisdictions?,"jurisdictions, applicable, laws, regulations",,[]
Legal and Compliance,Has the project obtained all necessary licenses and registrations?,"registrations, project, obtained, licenses",,[]
Legal and Compliance,What is the legal structure of the entity behind the digital asset?,"asset, legal, structure, entity, digital",,[]
Legal and Compliance,What are the legal rights and obligations of token holders?,"holders, legal, obligations, token",,[]
Legal and Compliance,"How does the project comply with data privacy regulations (e.g., GDPR)?","GDPR, regulations, project, comply, data",,[]
Legal and Compliance,"What data is collected from users, and how is it stored and protected?","users, protected, data, collected, stored",,[]
Legal and Compliance,What is the project's policy on data breaches and incident response?,"response, project, policy, data, breaches|plan, project, incident, response",,[]
Financial,What is the project's revenue model and financial performance?,"performance, project, revenue, model, financial",,[]
Financial,What is the token distribution and allocation?,"allocation, token, distribution",,[]
Financial,What is the token's utility and value proposition?,"proposition, token, utility|token, utility",,[]
Financial,What is the token's supply and demand dynamics?,"dynamics, token, supply, demand",,[]
Financial,Are there any risks of inflation or deflation?,"deflation, risks, inflation",,[]
Financial,What are the key financial risks associated with the digital asset?,"asset, key, financial, risks, digital",,[]
Financial,How does the project manage volatility and market fluctuations?,"fluctuations, project, manage, volatility, market",,[]
Financial,What are the potential risks of fraud or market manipulation?,"manipulation, potential, risks, fraud, market|volatility, potential, risks, market, manipulation",,[]
Technical,What blockchain technology is used?,"blockchain, technology|blockchain, technology, asset|blockchain, technology, secure|chosen, blockchain, technology, protocol",,[]
Technical,What is the security of the blockchain network?,"network, security, blockchain",,[]
Auditability,Has the blockchain been audited for vulnerabilities?,"vulnerabilities, blockchain, audited",,"[""Has the project's underlying code or protocol logic been audited for correctness and security vulnerabilities?""]"
Auditability,Are smart contracts used?,"smart, contracts|vulnerabilities, smart, contracts, audited|contracts immutable upgraded, smart contracts immutable, immutable upgraded changes|notified migration deadlines, migration deadlines, obsolete smart contracts|insurance code exploits, contracts covered insurance, smart contracts covered|smart contracts audited, contracts audited parties, contracts audited|irreversible losses mitigated, losses mitigated nfts, irreversible losses",,"['In smart contracts or documentation are stake holders rights clearly disclosed ?', 'Are token holder rights clearly disclosed in smart contracts or documentation?', 'Are token holder rights clearly disclosed in smart contracts or documentation ?', 'Are smart contracts written in audited, widely-used languages (e.g. Solidity, Vyper) ?', 'Are smart contracts written in widely-used, audited languages (e.g., Solidity, Vyper)', 'Are smart contracts written in audited, widely used languages (e.g., Solidity, Vyper)', 'Which programming languages (e.g., Solidity, Rust) are used for smart contracts, and are they audited for known vulnerabilities?', ""Do the smart contracts allow for automatic upgrades or emergency 'pause' functions, and under what conditions are these used?""]"
Technical,Have the smart contracts been audited for security and functionality?,"functionality, smart, contracts, audited, security",,[]
Technical,What is the risk of smart contract bugs or exploits?,"exploits, risk, smart, contract, bugs",,[]
Technical,Has the project undergone penetration testing and security audits?,"audits, project, undergone, penetration, testing",,[]
Technical,Are the private keys stored safely?,"safely, private, keys, stored",,[]
Technical,What are the procedures for recovering lost or stolen keys?,"keys, procedures, recovering, lost, stolen",,[]
Reputational and Strategic,What is the team's track record?,"record, team, track|identifiable, record, team, publicly, verifiable",,"['Who are business leaders, founders and core teams and what is their track record in crypto or fintech?', 'Who are the founders, executives and core team members and what is their track record in crypto or fintech?', 'Who are the founders, executives and core team members? Who is their background in crypto or fintech?', 'Identify the key founders, team members, and major investors, and what is their track record in the crypto or financial sector?']"
Legal and Compliance,Has the project obtained necessary licenses or approvals from regulatory bodies?,"bodies, project, obtained, licenses, approvals",,[]
Legal and Compliance,Are there any restrictions or bans on the asset in specific jurisdictions?,"jurisdictions, restrictions, bans, asset, specific",,[]
Legal and Compliance,"How does the project handle data privacy and protection (e.g., GDPR compliance)?","GDPR, protection, compliance, project, handle",,[]
Legal and Compliance,"Are there clear terms of service, disclaimers, and risk disclosures for users?","disclaimers, service, users, clear, terms",,[]
Legal and Compliance,Does the project have a legal opinion or whitepaper addressing its regulatory status?,"status, project, legal, opinion, whitepaper",,[]
Reputational and Strategic,Is the community engaged and supportive of the project?,"project, community, engaged, supportive",,[]
Reputational and Strategic,Are there any signs of manipulation or fake accounts inflating community metrics?,"metrics, signs, manipulation, fake, accounts",,[]
Reputational and Strategic,Does the project have a governance model that allows community participation?,"participation, project, governance, model, community",,[]
Reputational and Strategic,"Are there any grants, incentives, or developer programs to grow the ecosystem?","incentives, grants, ecosystem, developer, programs",,[]
Auditability,Has the project undergone a financial audit?,"audit, project, undergone, financial",,[]
Auditability,Are the project’s treasury and funds managed transparently?,"transparently, project, treasury, funds, managed",,[]
Auditability,How are funds raised through token sales or investments being allocated?,"allocated, funds, raised, token, sales",,[]
Auditability,Are there any concerns about the project’s financial sustainability or runway?,"runway, concerns, project, financial, sustainability|sustainability, concerns, project, long-term, viability|profitability, concerns, project, financial, sustainability",,[]
Reputational and Strategic,"What is the environmental impact of the cryptocurrency (e.g., energy consumption)?","cryptocurrency, energy, consumption, environmental, impact",,[]
Reputational and Strategic,Does the project promote social good or inclusivity?,"inclusivity, project, promote, social, good",,[]
Reputational and Strategic,Are there governance mechanisms in place to ensure fair decision-making?,"decision-making, governance, mechanisms, place, ensure",,[]
Reputational and Strategic,How does the project address ethical concerns related to its operations?,"operations, project, address, ethical, concerns",,[]
Legal and Compliance,Is the entity or project registered with any regulatory bodies?,"bodies, entity, project, registered, regulatory",,[]
Legal and Compliance,Is there a clear ownership structure for the project’s intellectual property?,"property, clear, ownership, structure, project",,[]
Technical,"Is the blockchain platform decentralized, or is it permissioned?","decentralized, permissioned, blockchain, platform",,[]
Technical,What security measures are in place to prevent hacks or breaches?,"breaches, security, measures, place, prevent",,[]
Technical,Are there bug bounty programs to encourage reporting vulnerabilities?,"vulnerabilities, bug, bounty, programs, encourage",,[]
Technical,What is the current throughput (transactions per second)?,"throughput, transactions, current",,[]
Technical,How does the platform handle scalability issues during periods of high usage?,"usage, platform, handle, scalability, issues",,[]
Technical,What are the plans for upgrades or improvements to the technical stack?,"stack, plans, upgrades, improvements, technical",,[]
Financial,"How many tokens are in circulation, and what is the total supply?","circulation, supply, tokens, total",,[]
Financial,Are there any existing partnerships or business agreements driving revenue?,"revenue, existing, partnerships, business, agreements",,[]
Financial,"How are raised funds stored (e.g., cold wallets, multi-signature wallets)?","wallets, stored, cold, multi-signature, raised",,[]
Financial,What is the burn or inflation rate of the token?,"token, burn, inflation, rate",,[]
Reputational and Strategic,Does the project have any known community advocates or influencers?,"influencers, project, community, advocates",,[]
Legal and Compliance,Does the project provide guidance or support for tax reporting?,"reporting, project, provide, guidance, support",,[]
Technical,Have the smart contracts been audited by reputable third parties?,"parties, smart, contracts, audited, reputable",,[]
Technical,Are the audit reports publicly accessible for review?,"review, audit, reports, publicly, accessible",,[]
Financial,What are the project's current and projected revenue streams?,"streams, project, current, projected, revenue",,[]
Financial,How does the project plan to achieve financial sustainability?,"sustainability, project, plan, achieve, financial",,[]
Financial,What are the primary use cases for the token within the project's ecosystem?,"ecosystem, primary, cases, token, project",,[]
Financial,Is there a clear demand for the token that supports its value proposition?,"proposition, clear, demand, token, supports",,[]
Reputational and Strategic,Is there an active developer community contributing to the project's growth?,"growth, active, developer, community, contributing",,[]
Reputational and Strategic,What is the general sentiment of the community towards the project?,"project, general, sentiment, community",,[]
Reputational and Strategic,"Are there channels for users to provide feedback, and how is it addressed?","feedback, addressed, channels, users, provide",,[]
Legal and Compliance,"Does the project have a clear legal structure (e.g., foundation, corporation, DAO)?","DAO, foundation, corporation, structure, project",,[]
Legal and Compliance,Are there any tax implications for holding or transacting with the asset?,"asset, tax, implications, holding, transacting",,[]
Legal and Compliance,How does the project handle cross-border transactions and regulatory differences?,"differences, project, handle, cross-border, transactions",,[]
Legal and Compliance,Are there any restrictions on the transfer or ownership of the asset?,"asset, restrictions, transfer, ownership",,[]
Legal and Compliance,Are there any pending or potential legislative changes that could impact the asset?,"asset, pending, potential, legislative, impact",,[]
Financial,How does the project manage inflation or deflation of the token?,"token, project, manage, inflation, deflation|supply, project, manage, inflation, deflation",,[]
Reputational and Strategic,How does the project handle community disputes or disagreements?,"disagreements, project, handle, community, disputes",,[]
Reputational and Strategic,Are there any incentives for developers to build on the platform?,"platform, incentives, developers, build",,[]
Reputational and Strategic,How does the project onboard new users or developers?,"developers, project, onboard, users",,[]
Reputational and Strategic,Are there any educational resources or documentation for the community?,"community, educational, resources, documentation",,[]
Reputational and Strategic,How does the project handle negative feedback or criticism from the community?,"community, project, handle, negative, feedback",,[]
Financial,Are there any signs of insider trading or market manipulation?,"manipulation, signs, insider, trading, market|manipulation, signs, wash, trading, forms",,[]
Auditability,Are there regular financial reports or updates for investors?,"investors, regular, financial, reports, updates",,[]
Auditability,How does the project manage its treasury or reserve funds?,"funds, project, manage, treasury, reserve|reserves, protocol, manage, treasury",,[]
Auditability,Are there any concerns about misallocation or misuse of funds?,"funds, concerns, misallocation, misuse",,[]
Auditability,Does the project have a clear budget or financial plan for the next 1-3 years?,"years, project, clear, budget, financial",,[]
Auditability,Are there any risks of insolvency or running out of funds?,"funds, risks, insolvency, running",,[]
Reputational and Strategic,Does the project have a sustainability plan to reduce its environmental impact?,"impact, project, sustainability, plan, reduce",,[]
Reputational and Strategic,How does the project contribute to social causes or communities?,"communities, project, contribute, social|initiatives, project, contribute, social, charitable",,[]
Reputational and Strategic,How does the project ensure diversity and inclusion within its team and community?,"community, project, ensure, diversity, inclusion",,[]
Reputational and Strategic,Are there any ethical concerns related to the project’s operations or goals?,"goals, ethical, concerns, related, project",,[]
Legal and Compliance,Who owns the intellectual property (IP) related to the project's technology?,"property, related, technology, intellectual, project",,[]
Legal and Compliance,What are the on chain analysis tools that they utilize to track illicit funds?,"funds, chain, analysis, tools, utilize",,[]
Legal and Compliance,How are liabilities handled within the DAO structure?,"DAO, structure, liabilities, handled",,[]
Legal and Compliance,What are the legal implications of the DAO's governance model?,"DAO, model, legal, implications, governance",,[]
Financial,Are there any mechanisms for burning or repurchasing tokens?,"tokens, mechanisms, burning, repurchasing",,[]
Financial,What is the token's velocity and circulation?,"circulation, token, velocity",,[]
Financial,How are the funds raised during token sales being used?,"funds, raised, token, sales",,[]
Financial,What stress testing has been conducted on the project's financial model?,"model, stress, testing, conducted, project",,[]
Financial,What is the projects treasury management strategy?,"strategy, projects, treasury, management",,[]
Financial,Which accounting standards are being used?,"accounting, standards",,[]
Financial,"Who are the auditors, and what is their reputation in the digital asset space?","auditors, space, reputation, digital, asset|auditors, reputation, security",,[]
Financial,Are there regular proof of reserve audits?,"audits, regular, proof, reserve",,[]
Technical,What specific cryptographic algorithms are used?,"specific, cryptographic, algorithms",,[]
Technical,What is the project's approach to key management and security?,"security, project, approach, key, management",,[]
Technical,Are there any known vulnerabilities in the underlying blockchain protocol?,"protocol, vulnerabilities, underlying, blockchain",,[]
Technical,What is the process for updating and patching the blockchain?,"blockchain, process, updating, patching",,[]
Technical,Has there been any previous exploits of the smart contract?,"contract, previous, exploits, smart",,[]
Technical,Are there any signs of malicious code or backdoors?,"backdoors, signs, malicious, code",,[]
Technical,What is the communities involvement in the open source project?,"project, communities, involvement, open, source",,[]
Auditability,How frequently are financial reports published?,"published, frequently, financial, reports",,"['Are regular third-party security or financial audits carried out, and how frequently are the reports published or accessible?']"
Legal and Compliance,In how many jurisdictions has the project ensured regulatory compliance?,"compliance, jurisdictions, project, ensured, regulatory",,[]
Legal and Compliance,Are there export controls or restrictions for certain countries?,"countries, export, controls, restrictions",,[]
Legal and Compliance,Are IP rights secured in major markets where the project intends to operate?,"operate, secured, major, markets, project",,[]
Technical,"What development methodology does the team follow (e.g., Agile, DevOps)?","Agile, DevOps, follow, development, methodology",,[]
Technical,"Are there regular updates to the codebase, and is there a public roadmap?","codebase, roadmap, regular, updates, public",,[]
Technical,What is the project's uptime percentage over the past year?,"year, project, uptime, percentage, past",,[]
Technical,Are there automated systems for monitoring and recovering from outages?,"outages, automated, systems, monitoring, recovering",,[]
Financial,"What were the sources of funding (e.g., ICO, private sales, venture capital)?","ICO, funding, private, sales, venture",,[]
Financial,What safeguards are in place to prevent misuse of funds?,"funds, safeguards, place, prevent, misuse",,[]
Financial,Are there any mechanisms for token buybacks or burns to regulate supply?,"supply, mechanisms, token, buybacks, burns",,[]
Financial,"How transparent are these policies, and how often are they executed?","policies, executed, transparent",,[]
Legal and Compliance,How does the project plan to adapt to potential regulatory changes?,"project, plan, adapt, potential, regulatory|project, plan, adapt, future, regulatory",,[]
Reputational and Strategic,Are there influential figures or ambassadors actively promoting the project?,"project, influential, figures, ambassadors, actively",,[]
Reputational and Strategic,What incentives are in place for advocates to remain engaged?,"engaged, incentives, place, advocates, remain",,[]
Reputational and Strategic,"Are there rewards for validators, miners, or liquidity providers?","miners, validators, providers, rewards, liquidity",,[]
Reputational and Strategic,How sustainable are these rewards over the long term?,"term, sustainable, rewards, long",,[]
Reputational and Strategic,Are there clear guides or resources to onboard new users or developers?,"developers, clear, guides, resources, onboard",,[]
Reputational and Strategic,How does the project handle technical support for users?,"users, project, handle, technical, support",,[]
Legal and Compliance,Are there any concerns about the project’s compliance with sanctions or embargoes?,"embargoes, concerns, project, compliance, sanctions",,[]
Reputational and Strategic,How does the project handle community governance or decision-making?,"decision-making, project, handle, community, governance",,[]
Reputational and Strategic,Are there any risks of community fragmentation or infighting?,"infighting, risks, community, fragmentation",,[]
Reputational and Strategic,How does the project plan to grow its ecosystem of developers and users?,"users, project, plan, grow, ecosystem",,[]
Reputational and Strategic,Are there any risks of the community losing trust in the project?,"project, risks, community, losing, trust",,[]
Reputational and Strategic,"How does the project handle negative sentiment or FUD (fear, uncertainty, doubt)?","fear, uncertainty, doubt, FUD, project",,[]
Reputational and Strategic,Are there any plans to incentivize community contributions or participation?,"participation, plans, incentivize, community, contributions",,[]
Auditability,How does the project handle investor relations or communication?,"communication, project, handle, investor, relations",,[]
Auditability,Are there any risks of the project running out of funding or going bankrupt?,"bankrupt, risks, project, running, funding",,[]
Auditability,How does the project plan to allocate funds raised from token sales or investments?,"investments, project, plan, allocate, funds",,[]
Reputational and Strategic,Does the project have a plan to offset its carbon footprint or environmental impact?,"impact, project, plan, offset, carbon",,"['Is the project have a clear policy or framework addressing its environmental impact (e.g., energy usage, carbon footprint)?']"
Legal and Compliance,How does the protocol address the risks of impermanent loss and liquidation?,"liquidation, protocol, address, risks, impermanent",,[]
Legal and Compliance,How does the project address the risks of counterfeit NFTs?,"NFTs, project, address, risks, counterfeit",,[]
Legal and Compliance,What are the legal implications of fractionalized NFTs?,"NFTs, legal, implications, fractionalized",,[]
Financial,What on-chain metrics are used to assess the health of the project's network?,"network, on-chain, metrics, assess, health",,[]
Financial,What are the risks of cascading liquidations in the protocol?,"protocol, risks, cascading, liquidations",,[]
Financial,What are the risks of oracle failures?,"failures, risks, oracle",,[]
Financial,"Are the stablecoins fully backed by reserves, and are those reserves audited?","audited, reserves, stablecoins, fully, backed",,[]
Financial,What are the de-pegging risks?,"risks, de-pegging",,[]
Financial,What valuation models are being used to assess the project's worth?,"worth, valuation, models, assess, project",,[]
Technical,What is the scope and depth of the formal verification process?,"process, scope, depth, formal, verification",,[]
Technical,What measures are being taken to mitigate those risks?,"risks, measures, mitigate",,[]
Legal and Compliance,How robust are the project’s KYC/AML processes?,"KYC, AML, processes, robust, project",,[]
Legal and Compliance,How does the project handle regulatory inquiries or subpoenas?,"subpoenas, project, handle, regulatory, inquiries",,[]
Legal and Compliance,Are there potential infringement risks due to similarities with other projects?,"projects, potential, infringement, risks, due",,[]
Technical,What encryption methods are used to secure transactions and data?,"data, encryption, methods, secure, transactions",,[]
Technical,What incentives are offered to ethical hackers or auditors?,"auditors, incentives, offered, ethical, hackers",,[]
Technical,Are there plans to expand interoperability with other DeFi ecosystems?,"ecosystems, plans, expand, interoperability, DeFi",,[]
Financial,How does the project generate revenue outside of token sales?,"sales, project, generate, revenue, token",,[]
Financial,Are there clear projections for future revenue growth?,"growth, clear, projections, future, revenue",,[]
Financial,How are pre-mined or reserved tokens allocated?,"allocated, pre-mined, reserved, tokens",,[]
Financial,Are vesting schedules for team members and investors strictly enforced?,"enforced, vesting, schedules, team, members",,[]
Financial,Does the project provide liquidity pools on decentralized exchanges (DEXs)?,"DEXs, exchanges, project, provide, liquidity",,[]
Financial,What are the annual percentage yields (APYs) for liquidity providers?,"APYs, yields, providers, annual, percentage",,[]
Reputational and Strategic,How responsive is the team to user feedback and concerns?,"concerns, responsive, team, user, feedback",,[]
Reputational and Strategic,How distributed is the network?,"network, distributed",,[]
Reputational and Strategic,How many third-party developers are actively building on the platform?,"platform, third-party, developers, actively, building",,[]
Reputational and Strategic,Are there incentives or grants for developers to contribute to the ecosystem?,"ecosystem, incentives, grants, developers, contribute",,[]
