Category,Question,YAKE Keywords,Severity Score,Variations
Technical,Have there been flash loan or oracle exploits on this protocol or similar ones in the ecosystem?,,,"['Have there been flash, swap or acme exploits on this protocol or similar ones in the ecosystem?', 'Have there been any flash loan or oracle exploits on this protocol or similar ones in the ecosystem?', 'Have there been flash loan or oracle-exploits on this protocol or similar ones in the ecosystem?']"
Technical,Are contracts covered by formal verification or continuous security fuzzing?,,,"['Which contracts are covered by formal verification or continuous security fuzzing ?', 'If not, are contracts covered by formal verification or continuous security fuzzing ?', 'Are contracts covered by the formal verification or Continued Security Fuzzing ?']"
Legal and Compliance,"Are on-chain AML analytics tools (e.g., TRM Labs, Chainalysis) used for monitoring wallet behavior?",,,"['If so are on-chain AML analytics tools (e.g., TRM Labs, Chainalysis) used for monitoring wallet behavior?', 'Are AML-Analytics-tools (e.g., TRM Labs, Chainalysis) used for the monitoring of wallet behavior?', 'Is used on-chain analytics tools (e.g., TRM Labs, Chainalytics) for observing wallet behavior?']"
Legal and Compliance,Is there a process to screen for sanctioned wallets or high-risk counterparties?,,,"['Is there a process to examine sanctioned wallets or risky counterparties?', 'Is there a process to screen for sanctioned wallets or high-risk counterparties?', 'Is there a formal process to screen for sanctioned wallets or high risk counterparties?']"
Legal and Compliance,"Does the platform support privacy-preserving KYC (e.g., zero-knowledge proofs)?",,,"['Does the platform support privacy-preserving KYC (e.g., zero-knowledge proofs) ?', 'Supports the platform privacy-preserving KYC (e.g.:', 'Does the platform support privacy-preserving KYC (e.g., zero-knowledge proofs)']"
Legal and Compliance,Are AML/KYC policies aligned with FATF Travel Rule requirements?,,,"['Are AML/KYC policies aligned with FATF travel rule requirements and other ?', 'Q. Are AML/KYC policies in accordance with the FATF travel rule requirements?', 'Are AML/KYC policies aligned with the FATF Travel Rule requirements ?']"
Legal and Compliance,How often is staff trained on evolving AML compliance risks?,,,"['How often is staff trained on evolving AML compliance risk?', 'How often is the staff trained on emerging AML compliance risks?', 'How often is staff trained on the AML compliance security changes?']"
Financial,Are assets priced using time-weighted average from multiple exchanges?,,,"['Are assets priced using a time-weighted average of multiple exchanges?', 'Are assets priced using time-weighted averages from multiple exchanges?', 'Are assets valued using a time-weighted average from multiple exchanges ?']"
Financial,"How are illiquid assets valued, and who signs off on methodology?",,,"['How are illiquid assets valued and who signs off on the methodology?', 'How are liquid assets valued and who signs off on the methodology?', 'How are illiquid assets valued, and who signs off on methodological values?']"
Financial,Are wallet addresses independently verified by fund administrators?,,,"['Are wallet addresses independently verified by fund administrators ?', 'Are the wallet addresses independently verified by the fund administrators?', 'Are wallet addresses independently verified by the fund administrators?']"
Financial,"How frequently is the fund’s NAV calculated, and are there deviation logs for exceptions?",,,"['How frequently is the NAV calculated for the fund and is there an exception log for deviations?', 'How frequently is the new value of the fund calculated and are there deviation logs for exceptions?', 'How often is the NAV calculated in the fund and will there be deviation records for exceptions?']"
Legal and Compliance,Is there a roadmap for future compliance in new jurisdictions?,,,"['Is there a roadmap for future compliance in new jurisdictions ?', 'Is there a roadmap for future compliance in new jurisdictions?']"
Legal and Compliance,Have the terms of use or whitepaper been legally vetted for investor disclosures?,,,"['Have the uses terms or the whitepaper been legally validated for investor disclosures ?', 'Have the terms of use or whitepaper been legally vetted for investor disclosures?', 'Have the conditions of use or whitepaper been vetted legally for investor disclosures']"
Legal and Compliance,Is there a clear distinction between utility and investment functions of the token?,,,"['Is there a clear distinction between the utility and investment functions of the token?', 'Is there a clear distinction between utility and investment functions of the token ?', 'Is there a clear distinction in the token between usage and investment functions?']"
Legal and Compliance,Has the project implemented data privacy policies in line with GDPR or other laws?,,,"['Is the project implementing rules related to data privacy in line with GDPR or other laws?', 'Has the project implemented data privacy policies in line with GDPR or other laws?']"
Cybersecurity,What is the incident response time target for security breaches?,,,"['What is the time target for incident response to security breaches?', 'What is the response time target for security breaches ?', 'What is the date of the incident response for security breaches ?']"
Cybersecurity,Are there anomaly detection systems in place for network activity?,,,"['Are there anomaly detection systems in place for network activity?', 'Are anomaly detection systems set in place for network activity?']"
Cybersecurity,Has the protocol been subjected to red teaming or adversarial testing?,,,"['Has the protocol been subject to red teaming or adversarial testing?', 'Has the protocol been subjected to red team testing or adversarial testing?']"
Cybersecurity,What role do validators or miners play in protocol-level security checks?,,,"['What role do validators or miners play in protocol-level security checks?', 'What role play validators or miners in protocol-level security checks?']"
Cybersecurity,"Who is the digital asset custodian, and is it a third party or self-custody setup?",,,"['Who is the digital asset – custodian and is it a third party firm or self-custody ?', 'Who is the custodian of electronic assets e.g. is it a third party or self-custodian?', 'Who is the custodian of the digital asset and is it a third party or Self-detached setup?']"
Cybersecurity,"How are private keys stored—air-gapped, HSM, or MPC-based infrastructure?",,,"['How are private keys stored – via air-gated, HSM or MPC – ?', 'How are private keys stored -- air-gapped, HSM or MPC-based infrastructure', 'How are private keys stored—air-gapped, HSM or MPC-based infrastructure']"
Cybersecurity,Does the custodian offer verifiable proof-of-reserves?,,,"['Offers the custody a verifiable proof of reservation ?', 'Offers the custodian verifiable proof-of-reserves?', 'Offers the custodian verifiable proof of reserve?']"
Cybersecurity,"In cases of self-custody, what controls ensure exclusive access to private keys?",,,"['What controls ensure exclusive access to private keys in cases of self custody ?', ""What controls in self-trauma cases ', guarantee exclusive access to private keys ?"", 'What controls ensure obedient access to public keys in self - custody cases ?']"
Cybersecurity,Are wallet addresses segregated and attributable per investor?,,,"['Addresses of wallet are segregated and attributable per investor?', 'Are wallet addresses segregated and attributable per investor?', 'Are wallet addresses segregated and attributable to the investors?']"
Legal and Compliance,"Is the project aligned with MiCA, FATF, and national frameworks (e.g., SEC, CFTC, MAS)?",,,"['Is the project aligned with MiCA, FATF and national frameworks (e.g. SEC, CFTC, MAS)?', 'Is the Project aligned with MiCA, FATF and national frameworks (e.g., SEC, CFTC, MAS) ?', 'Does the project align with MiCA, FATF, and national frameworks (e.g.']"
Legal and Compliance,Are Travel Rule compliance mechanisms in place for transfers above set thresholds?,,,"['These compliance mechanisms are in place for transfers above the given thresholds .', 'Is there a mechanism in place for Travel Rule compliance for transfers above limit limits?', 'Travel rules compliance mechanisms are in place for transfers over specified thresholds ?']"
Legal and Compliance,"What sandbox programs (e.g., HKMA, EU DLT Pilot Regime) has the project participated in?",,,"['In what Sandbox Programs (e.g., HKMA, EU DLT Pilot Regime ) has participated the project?', 'What Sandbox programs (e.g. HKMA, EU DLT Pilot Regime) has participated the project ?', 'In what sandbox programs (e.g., HKMA, the EU DLT pilot program) has participated the project?']"
Legal and Compliance,How does the entity classify tokens under securities law across jurisdictions?,,,"['How does the entity categorize tokens under securities law across jurisdictions ?', 'How does the entity distinguish tokens across jurisdictions under securities law?', 'How does the entity classify tokens in securities law across jurisdictions ?']"
Legal and Compliance,Has the issuer published mandatory whitepapers as per MiCA or local equivalents?,,,"['Has the issuer published mandatory whitepapers based on MiCA or local equivalents ?', 'The issuer has issued mandatory whitepapers , as mandated by MiCA or other local equivalents ?', 'Has the E issuer published mandatory whitepapers as per MiCA or local equivalents ?']"
Reputational and Strategic,"Are the founders and executives publicly identifiable, and do they have any history of controversies or regulatory violations?",,,"['Are the founders and executives publicly identifiable, and do they have any history of controversies or regulatory violations?']"
Reputational and Strategic,"Is there a succession plan for key individuals, and how does the project mitigate key-person risk?",,,"['Is there a succession plan for key individuals, and how does the project mitigate key-person risk?']"
Reputational and Strategic,"Have there been any significant changes in the leadership team recently, and how were these communicated to stakeholders?",,,"['Have there been any significant changes in the leadership team recently, and how were these communicated to stakeholders?']"
Reputational and Strategic,"How is the entity structured legally (e.g., foundation, corporation, DAO), and is this structure transparent and adequately documented?",,,"['How is the entity structured legally (e.g., foundation, corporation, DAO), and is this structure transparent and adequately documented?']"
Reputational and Strategic,"Are there any outstanding legal disputes, regulatory investigations, or credible allegations against the team or the entity?",,,"['Do any any outstanding legal disputes, regulatory investigations, or credible allegations against the team or the entity?']"
Reputational and Strategic,How does the project handle accountability and public communication if a senior member is implicated in misconduct?,,,['In what way does the project handle accountability and public communication if a senior member is implicated in misconduct?']
Reputational and Strategic,"Is there a publicly available ESG report or sustainability roadmap, and what metrics are used to track performance?",,,"['Is there a publicly available ESG report or sustainability roadmap, and what metrics are used to track performance?']"
Reputational and Strategic,"How does the consensus mechanism (e.g., Proof-of-Work, Proof-of-Stake) impact the project's overall environmental footprint?",,,"[""In what way does the consensus mechanism (e.g., Proof-of-Work, Proof-of-Stake) impact the project's overall environmental footprint?""]"
Reputational and Strategic,"What community or social initiatives does the project support or participate in, and how are they funded?",,,"['What community or social initiatives does the project support or participate in, and how are they funded?']"
Reputational and Strategic,"Have any known ESG concerns been identified, and how is the team working to address or mitigate them?",,,"['Have any known ESG concerns been identified, and how is the team working to address or mitigate them?']"
Reputational and Strategic,Does the project have policies ensuring fair labour practices and diversity among its team and validators/miners (if applicable)?,,,['Is the project have policies ensuring fair labour practices and diversity among its team and validators/miners (if applicable)?']
Reputational and Strategic,Are there governance mechanisms to allow stakeholder input into environmental or social impact decisions?,,,['Do any governance mechanisms to allow stakeholder input into environmental or social impact decisions?']
Reputational and Strategic,How does the project integrate ESG considerations into its long-term strategic planning and reporting?,,,['In what way does the project integrate ESG considerations into its long-term strategic planning and reporting?']
Legal and Compliance,Has the token or digital asset been evaluated under the Howey Test (or comparable local standard) to determine if it is a security?,,,['Has the token or digital asset been evaluated under the Howey Test (or comparable local standard) to determine if it is a security?']
Legal and Compliance,Are there legal opinions or memoranda publicly available that clarify the asset's classification under securities laws?,,,"[""Do any legal opinions or memoranda publicly available that clarify the asset's classification under securities laws?""]"
Legal and Compliance,Has the project conducted any token sales or offerings that could be subject to retrospective regulatory scrutiny?,,,['Has the project conducted any token sales or offerings that could be subject to retrospective regulatory scrutiny?']
Legal and Compliance,"Does the project comply with disclosures, filings, or registrations required in any jurisdictions where it operates?",,,"['Is the project comply with disclosures, filings, or registrations required in any jurisdictions where it operates?']"
Legal and Compliance,"If the token is used for fundraising, were proper exemptions (Reg D, Reg S, etc.) or equivalent utilized, and is ongoing compliance maintained?",,,"['If the token is used for fundraising, were proper exemptions (Reg D, Reg S, etc.) or equivalent utilized, and is ongoing compliance maintained?']"
Legal and Compliance,"Which jurisdictions currently restrict or forbid the trading of this token, and how does the project handle users from those regions?",,,"['Which jurisdictions currently restrict or forbid the trading of this token, and how does the project handle users from those regions?']"
Legal and Compliance,"Are there or have there been any class-action lawsuits, SEC investigations, or regulatory enforcement actions involving the token?",,,"['Do any or have there been any class-action lawsuits, SEC investigations, or regulatory enforcement actions involving the token?']"
Legal and Compliance,How does the project anticipate and adapt to evolving securities laws across different countries?,,,['In what way does the project anticipate and adapt to evolving securities laws across different countries?']
Legal and Compliance,"Which specific AML/KYC frameworks does the project adhere to, and are they aligned with FATF recommendations or local regulations?",,,"['Which specific AML/KYC frameworks does the project adhere to, and are they aligned with FATF recommendations or local regulations?']"
Legal and Compliance,"Does the project have dedicated compliance officers, and are they experienced in digital asset regulations?",,,"['Is the project have dedicated compliance officers, and are they experienced in digital asset regulations?']"
Legal and Compliance,How does the project ensure ongoing compliance with sanctions regimes or restricted jurisdictions?,,,['In what way does the project ensure ongoing compliance with sanctions regimes or restricted jurisdictions?']
Legal and Compliance,Are there defined processes for suspicious activity reporting and transaction monitoring on-chain?,,,['Do any defined processes for suspicious activity reporting and transaction monitoring on-chain?']
Legal and Compliance,How does the project manage data protection obligations such as GDPR or other privacy laws?,,,['In what way does the project manage data protection obligations such as GDPR or other privacy laws?']
Legal and Compliance,"If the platform provides exchange or custodial services, is it registered or licensed with relevant financial authorities?",,,"['If the platform provides exchange or custodial services, is it registered or licensed with relevant financial authorities?']"
Legal and Compliance,"Does the project have a formal code of conduct or compliance handbook, and are staff regularly trained on it?",,,"['Is the project have a formal code of conduct or compliance handbook, and are staff regularly trained on it?']"
Legal and Compliance,How do governance token holders or the foundation (if applicable) handle compliance oversight?,,,['How do governance token holders or the foundation (if applicable) handle compliance oversight?']
Legal and Compliance,"Has the project historically been connected to any money laundering, terrorist financing, or hacking incidents?",,,"['Has the project historically been connected to any money laundering, terrorist financing, or hacking incidents?']"
Legal and Compliance,What thresholds or alerts trigger enhanced due diligence for large or suspicious transactions?,,,['What thresholds or alerts trigger enhanced due diligence for large or suspicious transactions?']
Legal and Compliance,How does the project mitigate the risk of privacy-enhancing features (like mixers or tumblers) being used maliciously?,,,['In what way does the project mitigate the risk of privacy-enhancing features (like mixers or tumblers) being used maliciously?']
Legal and Compliance,"Are addresses or entities identified on sanctions lists (e.g., OFAC, EU sanctions) proactively blocked or flagged?",,,"['Are addresses or entities identified on sanctions lists (e.g., OFAC, EU sanctions) proactively blocked or flagged?']"
Legal and Compliance,Does the project collaborate with law enforcement agencies or industry consortia to share threat intelligence?,,,['Is the project collaborate with law enforcement agencies or industry consortia to share threat intelligence?']
Legal and Compliance,Are there protocols to freeze assets or halt transactions in the event of a security breach or regulatory directive?,,,['Do any protocols to freeze assets or halt transactions in the event of a security breach or regulatory directive?']
Legal and Compliance,What measures are in place to address potential black market or dark web usage of the token or platform?,,,['What measures are in place to address potential black market or dark web usage of the token or platform?']
Cybersecurity,"Is there a clear framework for cybersecurity governance, and who is accountable at an executive level?",,,"['Is there a clear framework for cybersecurity governance, and who is accountable at an executive level?']"
Cybersecurity,"Does the project conduct periodic penetration tests or red-team exercises, and are results used to improve security posture?",,,"['Is the project conduct periodic penetration tests or red-team exercises, and are results used to improve security posture?']"
Cybersecurity,Which hardware security modules (HSMs) or other secure key management systems are used for private key custody?,,,['Which hardware security modules (HSMs) or other secure key management systems are used for private key custody?']
Cybersecurity,"Are bug bounty programs in place to incentivize ethical hacking, and how does the team respond to reported vulnerabilities?",,,"['Are bug bounty programs in place to incentivize ethical hacking, and how does the team respond to reported vulnerabilities?']"
Cybersecurity,"What is the process for managing zero-day exploits or critical vulnerabilities (e.g. crisis response teams, hotfix protocols)?",,,"['Define the process for managing zero-day exploits or critical vulnerabilities (e.g. crisis response teams, hotfix protocols)?']"
Cybersecurity,"Is multi-factor authentication (MFA) mandatory for all administrators, developers, and high-privilege accounts?",,,"['Is multi-factor authentication (MFA) mandatory for all administrators, developers, and high-privilege accounts?']"
Cybersecurity,"How is physical security addressed in data centres, hardware wallets, or any colocation facilities?",,,"['How is physical security addressed in data centres, hardware wallets, or any colocation facilities?']"
Cybersecurity,"Does the project follow any well-known security frameworks (ISO 27001, NIST Cybersecurity Framework, etc.) for best practices?",,,"['Is the project follow any well-known security frameworks (ISO 27001, NIST Cybersecurity Framework, etc.) for best practices?']"
Auditability,"Which audit firms or reputable third-party organizations have been engaged, and what was the scope of each audit?",,,"['Which audit firms or reputable third-party organizations have been engaged, and what was the scope of each audit?']"
Auditability,Does the project publicly share cryptographic proof of reserves or on-chain attestations for asset ownership?,,,['Is the project publicly share cryptographic proof of reserves or on-chain attestations for asset ownership?']
Auditability,"How are compliance audits (like SOC 1/2 or ISAE 3402) handled, and are their results disclosed to stakeholders?",,,"['How are compliance audits (like SOC 1/2 or ISAE 3402) handled, and are their results disclosed to stakeholders?']"
Auditability,Are transaction histories and logs easily accessible and verifiable on-chain for transparency?,,,['Are transaction histories and logs easily accessible and verifiable on-chain for transparency?']
Auditability,"Are token holders or governing bodies empowered to request or approve special audits (e.g., for treasury activities)?",,,"['Are token holders or governing bodies empowered to request or approve special audits (e.g., for treasury activities)?']"
Auditability,"In cases of asset tokenization, how does the project legally ensure that on-chain ownership matches real-world rights?",,,"['In cases of asset tokenization, how does the project legally ensure that on-chain ownership matches real-world rights?']"
Auditability,"How frequently is environmental, social and governance (esg) evaluated or updated, and by whom?",,,"['How frequently is environmental, social and governance (esg) evaluated or updated, and by whom?', 'How frequently is revenue model evaluated or updated, and by whom?', 'How frequently is network design evaluated or updated, and by whom?', 'How frequently is audit and ownership evaluated or updated, and by whom?', 'How frequently is aml/kyc evaluated or updated, and by whom?', 'How frequently is transparency evaluated or updated, and by whom?', 'How frequently is data integrity evaluated or updated, and by whom?', 'How frequently is tokenomics evaluated or updated, and by whom?', 'How frequently is governance and operational security evaluated or updated, and by whom?', 'How frequently is people and entity evaluated or updated, and by whom?']"
Cybersecurity,What are the biggest risks currently facing the project's strategic partnerships practices?,,,"[""What are the biggest risks currently facing the project's strategic partnerships practices?"", ""What are the biggest risks currently facing the project's revenue model practices?"", ""What are the biggest risks currently facing the project's endpoint security practices?"", ""What are the biggest risks currently facing the project's threat intelligence practices?"", ""What are the biggest risks currently facing the project's network design practices?"", ""What are the biggest risks currently facing the project's securities analysis practices?"", ""What are the biggest risks currently facing the project's audit and ownership practices?"", ""What are the biggest risks currently facing the project's smart contract risk practices?"", ""What are the biggest risks currently facing the project's aml/kyc practices?"", ""What are the biggest risks currently facing the project's transparency practices?"", ""What are the biggest risks currently facing the project's proof-of-reserves practices?"", ""What are the biggest risks currently facing the project's protocol scalability practices?"", ""What are the biggest risks currently facing the project's regulatory reporting practices?"", ""What are the biggest risks currently facing the project's interoperability practices?"", ""What are the biggest risks currently facing the project's privacy compliance practices?"", ""What are the biggest risks currently facing the project's data integrity practices?"", ""What are the biggest risks currently facing the project's tokenomics practices?"", ""What are the biggest risks currently facing the project's people and entity practices?"", ""What are the biggest risks currently facing the project's financial metrics practices?"", ""What are the biggest risks currently facing the project's attack mitigation practices?"", ""What are the biggest risks currently facing the project's treasury management practices?"", ""What are the biggest risks currently facing the project's disaster recovery practices?""]"
